Original_Response,Translated_Response
Je trouve que la gestion simultanée de deux ou plusieurs courriels (suppression,I find that the simultaneous management of two or more emails (deletion
L'option de recherche des mails dysfonctionne plusieurs fois par jour. Les vignettes avec les initiales sont beguées.,The option of searching emails dysfunction several times a day. The vignettes with the initials are beguged.
C'est une belle application mais encore des améliorations,It is a great application but still improvements
Je trouve les questions de ce questionnaire bizarre,I find the questions of this bizarre questionnaire
Beaucoup de choses à revoir.,Many things to review.
=> beaucoup d'efforts seront à fournir pour arriver au niveau d'un webmail digne de ce nom,=> Many efforts will be made to reach a webmail worthy of the name
manque beaucoup de fonctionnalités par rapport à d'autres interfaces de gestion des mails,Lack of a lot of features compared to other email management interfaces
Pourrait-on récupérer automatiquement les adresses mail des expéditeurs ?,Could we automatically recover the senders' email addresses?
-Impossibilité d'envoyer un mail à un groupe de contacts,-Impossibility to send an email to a group of contacts
Serait-il possible d'ajouter d'autres nuances de couleurs pour les dossiers de mail svp ?,Would it be possible to add other shades of colors for email files please?
Certaines personnes n'ont pas remarqué ou ne savent pas modifier le nom Default de leur compte mail. Serait-il possible de mettre automatiquement un nom en fonction de l'adresse mail dans le nom du compte svp ? Il est parfois difficile de se rendre compte de qui nous a envoyé un mail lorsque tout le monde s'appelle Default.,Some people have not noticed or cannot change the name DEFAULT from their mail account. Would it be possible to automatically put a name according to the email address in the name of the account please? It is sometimes difficult to realize who sent us an email when everyone is called Default.
Merci pour ces prises en compte,Thank you for these taking into account
BOITE MAILPAS SUPERBE,Superb mailbox
Je pense que ce ZEXTRAS Services me plaît.,I think I like this Zextras Services.
L'ergonomie et le volume de fonctionnalités de Carbonio est très en dessous de Zimbra 8. Seuls la quantité de bugs est au dessus :-(,The ergonomics and the volume of carbonio features is much below Zimbra 8. Only the quantity of bugs is above :-(
l'envoi des mails nécessite parfois un double appui sur le bouton envoyer.,The sending of emails sometimes requires double support on the Envy button.
Enormément de problèmes d'ergonomie dans cette interface.,Hurnedly for ergonomics problems in this interface.
Nous allons envoyer des demandes via le support pour certain bug/améliorations,We will send requests via the support for some bug/improvements
Difficultés rencontrées pour sélectionner plusieurs courriels devant être annulés simultanément afin d'épurer.,Difficulties encountered to select several emails to be canceled simultaneously in order to purify.
utilisation de carbonio uniquement si thunderbird est indisponible,use of carbonio only if Thunderbird is unavailable
Nous avons pas mal de probleme lorsqu'on utilise plusieurs boites mails. Les réponses ne sont pas rattaché avec l'adresse mail qui reçoit le mail,We have a lot of problem when using several mailboxes. The answers are not attached with the email address that receives the email
En attente d'un outil plus intuitif.,Awaiting a more intuitive tool.
A quand une revision de l'interface d'administration?,When will a revision of the administration interface be reviewed?
Les points à travailler en priorité :,The points to work in priority:
- Sélection de mails (trop de scroll à faire dans les dossiers lourds) et déplacement,- Selection of emails (too much scroll to do in heavy folders) and displacement
- Recherche de mails (à l'heure actuelle pas efficace si on met plusieurs mots),- Mail search (right now not effective if we put several words)
non pas besoin,no need
il serait profitable de pouvoir sélectionner plusieurs contact pour envoyer un email groupé plutôt que devoir constituer des groupes de contacts.,It would be profitable to be able to select several contacts to send a group email rather than having to constitute groups of contacts.
Les étiquettes devraient pouvoir être formalisées pour les boîtes mails partagées afin que nous ayons accès aux mêmes étiquettes.,The labels should be able to be formalized for shared email boxes so that we have access to the same labels.
Carbonio est bien loin d'être aisé. Très peu commode et difficile d'utilisation et de lecture,Carbonio is far from easy. Very little convenient and difficult to use and read
Amélioration de la recherche par expéditeurs. Amélioration de la coloration des mails plutôt que des marqueurs seuls.,Improvement of searches by sender. Improved email coloring rather than markers alone.
Pourquoi ne peut on pas épingler les mails?,Why can't we pin the emails?
Le traitement des contacts n'est pas satisfaisante non plus,The processing of contacts is not satisfactory either
pouvoir répondre à un mail lorsqu'il est affiché en plein écran serait bien,being able to respond to an email when displayed in full screen would be good
pas bien,not well
l'interface est à revoir. je travaille beaucoup avec mes mails et je regrette outlook qui etait plus intuitif et lisible,The interface is to be reviewed. I work a lot with my emails and I regret Outlook who was more intuitive and readable
logiciel bien,good software
Il y a encore beaucoup trop de bugs non cités dans les questions de ce sondage ...,There are still far too many bugs not mentioned in the questions of this survey ...
l'ergonomie est déplorable (ex : la rédaction d'un mail ne peut pas se faire sans passer en pleine page pour lire sans défilement à la fois l'adresse du destinataire et le texte aussi court soit il) la fenêtre dans laquelle j'écris ce texte en est d'ailleurs un autre exemple,"Ergonomics are deplorable (e.g. writing an email cannot be done without going in full page to read without scrolling both the address of the recipient and the text as short, it is it) the window in which I write this text is another example"
la création de dossiers d'archivage est indigne d'un logiciel pro,The creation of archiving files is unworthy of pro software
la fonction coller depuis la souris ne fonctionne pas,The sticking function from the mouse does not work
la gestion alphabétique des contacts ne porte pas sur le nom mais sur le prénom ce qui ne me convient pas,Alphabetical management of contacts does not relate to the name but to the first name which does not suit me
produit non terminé,unpleasant product
Globalement j'ai du mal avec cette messagerie surtout pour retrouver des emails,Overall I have trouble with this messaging especially to find emails
Une fois la recherche faite on clique sur le mail et le contenu n'apparait pas,Once the search is done we click on the email and the content does not appear
Cette messagerie est tout sauf intuitive et la rend inutilisable.,This messaging is anything but intuitive and makes it unusable.
- La gestion des mails filtrés (après une recherche sur un terme ou un nom) est difficile. Certes les étiquettes semblent être une partie de la solution mais ne répondent pas à toutes les possibilités de filtrage. Donc filtrage à revoir.,- The management of filtered emails (after a search on a term or a name) is difficult. Certainly the labels seem to be a part of the solution but do not respond to all the possibilities of filtering. So filter to review.
Il est pénible de devoir rentrer ses codes pour accéder à la messagerie alors qu'on y accède depuis le biome (pour lequel on a déjà rentré ses codes),It is painful to have to enter your codes to access messaging when you have access to it from the biome (for which we have already returned his codes)
Il n'y a pas assez d'étiquette de couleur et les couleurs choisi ne se mettent pas sur la totalité de la ligne,There is not enough color label and the colors chosen do not put themselves on the entire line
La recherche d'un mail dans un seul dossier n'est plus possible,The search for an email in a single file is no longer possible
Pas simple d'utilisation- Pas de formation ou d'aide à l'utilisation - Marquer les mails importants avec des couleurs différentes : je ne sais pas faire,Not easy to use - no training or use help - mark important emails with different colors: I don't know how to do
Mes mails ne sont pas imprimés correctement ou imprimés sur la totalité de la discussion ou en double sur une page... Assez déçue,My emails are not printed properly or printed on the entire discussion or double on a page ... quite disappointed
Quelques problèmes rencontrés :,Some problems encountered:
- Barre de résultats à gauche peu lisible : il serait agréable de pouvoir élargir cette barre afin d'afficher des titres plus détaillés.,- Little readable results bar: it would be pleasant to be able to widen this bar in order to display more detailed titles.
Merci beaucoup d'avoir sollicité notre avis.,Thank you very much for requiring our opinion.
J'aurais aimé disposer d'une boîte permanente (et non pas à générer à chaque fois avec une recherche / filtre) des non lus (mails en attente de réponse pour moi),I would have liked to have a permanent box (and not to generate each time with a search / filter) of non -read (emails awaiting response for me)
Cette messagerie est complètement inefficace et loin d'être pratique.,This messaging is completely ineffective and far from practical.
La police par défaut est trop petite. Je dois la modifier à chaque fois que je me connecte. Impossible d'enregistrer une fois pour toutes le paramètre. Sinon très utile et pratique. Merci,The default police are too small. I have to change it every time I connect. Impossible to record once and for all the parameter. Otherwise very useful and practical. THANKS
- lorsque le mail pop up on voit un aperçu du mail mais pas le nom ni l'adresse mail du destinataire,- When the pop -up email we see an overview of the email but not the name or the recipient's email address
L'ancien wbmail était plus clair,The old wbmail was clearer
Le tri/la recherche des mails est compliqué(e),The sorting/email search is complicated
Je trouve qu'il y a un manque de visibilité pour l'objet du mail.,I find that there is a lack of visibility for the subject of the email.
Modifier un brouillon n'est pas aussi simple qu'avec la précédente messagerie.,Modifying a draft is not as simple as with the previous messaging.
Nous ne pouvons plus lire les émojis.,We can no longer read the emojis.
il faudrait supprimer les initiales dans les ronds devant les mails : ne sert à rien + pollution visuelle,The initials should be removed in the circles in front of the emails: is useless + visual pollution
Le changement de messagerie ne constitue pas un progrès pour ce qui en usent (comparativement à l'ancienne...).,The change of messaging is not progress for what use it (compared to the old -fashioned ...).
Je souhaiterais avoir à nouveau accès à la messagerie Thunderbird dont les fonctionnalités me satisfaisaient pleinement...,I would like to have access to Thunderbird messaging again whose features fully satisfied me ...
La fenêtre d'écriture des mails en réponses est trop petite et mal située,The mail writing window is too small and poorly located
le problème est la non-synchronisation avec outlook des messages envoyés,The problem is the non-synchronization with Outlook of messages sent
Je n'ai pas de commentaires à ajouter pour l'instant,I have no comments to add for now
La recherche d'un mail n'est pas assez sélective.,The search for an email is not selective enough.
Il faudrait avoir le choix d'ouvrir une nouvelle fenêtre ou non lorsque l'on répond à un mail.,You should have the choice to open a new window or not when you respond to an email.
Modifier la police et le contraste – rendre plus performante la recherche de mails et pièces jointes – agrandir les marqueurs de mails (petits drapeaux) – résoudre le problème de la disparition (ou marqué comme non lu) des mails envoyés,Modify the police and the contrast - make the search for emails and attachments more efficient - enlarge the markers of emails (small flags) - solve the problem of the disappearance (or marked as not read) of the emails sent
Pouvoir répondre plus facilement (sans ouverture de fenêtre),Be able to respond more easily (without window opening)
Icone marqueur plus visible,More visible marker icon
Je suis très insatisfaite de l'ergonomie de cette nouvelle interface.,I am very unsatisfied with the ergonomics of this new interface.
Oui. Que la modification de l'affichage soit conservé. Lorsqu'on modifie la taille des caractères ça n'est pas persistant,Yes. That the modification of the display is kept. When we modify the size of the characters it is not persistent
Je voudrais pouvoir composer mes mails dans une fenêtre distincte (pop-up). Le compositeur de courriel actuel est catastrophique comparé à la solution précédente (bluemind).,I would like to be able to compose my emails in a separate window (pop-up). The current email composer is catastrophic compared to the previous solution (Bluemind).
Le principal problème des mails est l’indisponibilité de la messagerie (cycle de redirections infini).,The main problem of emails is the unavailability of messaging (infinite redirect cycle).
Faites quelque chose qui fonctionne avec une barre de recherche rapide,Do something that works with a quick search bar
Interface peu fluide.,Not very fluid interface.
J’en viens à écrire mes messages dans word et à faire des copier/coller.,I come to write my messages in Word and copy/paste.
J’espère vraiment qu’il va y avoir une NETTE amélioration rapidement.,I really hope there will be a clear improvement quickly.
Merci de l’attention que vous porterez à ce message,Thank you for the attention you will pay to this message
J'aimerai bien qu'il y ait aussi un sondage sur l'utilisation du calendrier électronique que je trouve très défectueux dans son utilisation.,I would like there to also be a survey on the use of the electronic calendar that I find very defective in its use.
l'ancienne version était bien plus facile d'utilisation.,The old version was much easier to use.
Depuis le changement de la messagerie difficile de s'y retrouver je la trouve moins pratique. Je préférais l'ancienne.,Since the change of messaging difficult to find your way I find it less practical. I preferred the old one.
Très mauvaises cette nouvelle gestion courriels.,Very bad this new email management.
Améliorer la recherche de mails,Improve email search
Les initiales de l'interlocuteur sont totalement inutiles. Application non fonctionnelle et illisible.,The initials of the interlocutor are completely useless. Non -functional and illegible application.
Dans un message (en tous cas sous Chrome) il est impossible de faire un copier-coller d'un lien via le bouton droit de la souris.,In a message (in any case under Chrome) it is impossible to copy and paste with a link via the right button of the mouse.
Plusieurs petits points :,Several small points:
° La fenêtre d'écriture du nouveau courrier est une bonne amélioration,° The new mail writing window is a good improvement
Je suis insatisfaite de cette messagerie,I am dissatisfied with this messaging
Priorité d'amélioration : la taille des icônes de gestion des emails / la recherche textuelle multi mots,Improvement priority: size of email management icons / Multi Word textual research
Changer de messagerie !,Change messaging!
Très peu convivial. Retour en début de liste des e.mails à chaque fois. Icones peu claires et navigation compliquée. Impossible à utiliser à l'étranger ou très compliqué.,Very little friendly. Back at the start of the list of e.mails each time. Unclear icons and complicated navigation. Unable to use abroad or very complicated.
Il est difficile de voir la liste des destinataire d’un mail dans l’interface une fois celui ci reçu ou envoyé.,It is difficult to see the list of recipients of an email in the interface once it has been received or sent.
Quelques soucis parfois avec Firefox : la boîte mail ne s’affiche pas ( page blanche ) pas de soucis avec chrome.,Some concerns sometimes with Firefox: the mailbox is not displayed (blank page) no worries with chrome.
Cependant les ordinateurs de l’université sont majoritairement sous Firefox ( impossible d’utiliser chrome).,"However, the university computers are mainly under Firefox (impossible to use Chrome)."
Je ne suis pas satisfaite de la présentation des mails et pas du tout satisfaite de l'affichage des agendas qui est très brouillon surtout quand on doit utiliser plusieurs agendas pour travailler. Je perds beaucoup de temps avec ce nouvel outil.,I am not satisfied with the presentation of emails and not at all satisfied with the display of agendas which is very rough especially when you have to use several agendas to work. I waste a lot of time with this new tool.
je ne suis pas du tout satisfaite de carbonio que ce soit des mails et encore moins du calendrier,I am not at all satisfied with carbonio that it is emails and even less of the calendar
toutes les fonctionnalités sont à revoir car actuellement rien n'est intuitif,All features are to be reviewed because currently nothing is intuitive
Pour les mails il faut pouvoir ouvrir dans un autre onglet et pouvoir le mettre en vis à vis.,For emails you have to be able to open in another tab and be able to put it on the opposite.
On devrait pouvoir redimensionner la largeur de la colonne des dossiers,We should be able to resize the width of the file of files
Il est crucial de distinguer étiquettes de messages et catégorie d'event de calendrier,It is crucial to distinguish message labels and calendar event category
Utilisation absolument pas intuitive. Complexité de l'outil. Recherche d'un mail passé extrêmement long.,Absolutely not intuitive use. Complexity of the tool. Search for an extremely long past email.
Comment voit-on le poids d'un message ? le poids de la messagerie et son % d'occupation ?,How do we see the weight of a message? The weight of messaging and its % occupancy?
L'architecture des dossiers classés n'est pas satisfaisante en ergonomie. Manque de visibilité des dossiers / sous-dossiers,The architecture of classified files is not satisfactory in ergonomics. Lack of visibility of files / subfolders
Il faut pouvoir rédiger les courriers dans une autre fenêtre et non pas dans l'interface ce qui rend l'utilisation moins agréable.,You have to be able to write letters in another window and not in the interface which makes use less pleasant.
Le marquage (drapeau) est trop peu visible.,The marking (flag) is too little visible.
La mise en évidence des initiales dans l'icône de réception d'un mail est complètement inefficace. Il faudrait voir systématiquement l'adresse de l'expéditeur.,The highlighting of initials in the mail reception icon is completely ineffective. You should systematically see the address of the sender.
- sélection multiples pour déplacer ou supprimer des mails sans en choisir qu'un ou tous,- multiple selection to move or delete emails without choosing one or all
- lenteur parfois de récupération des adresses mails de l'annuaire interne,- Slow sometimes recovery of email addresses from the internal directory
- icônes actions petites,- Small actions icons
mauvaise visibilité des pièces jointes aux mails.,Poor visibility of attachments to emails.
Le pop up enregistré dans les brouillons vient s'appliquer sur le texte de l'email. C'est gênant.,The pop -up recorded in the drafts applies to the text of the email. It's embarrassing.
La messagerie est complexe à utiliser . La précédente était bien mieux,Mail is complex to use. The previous one was much better
pouvoir afficher que les mails non lu,be able to display that unread emails
La recherche de mails par objet ou mot clefs manque,The search for emails by object or keyword lacks
